{
  "schema_version": 1,
  "experiment_id": "32001786-49f1-4b22-801e-2d3afb729ef8",
  "suite": "fixture",
  "started_at": "2026-10-12T20:26:56.220717+00:00",
  "database_backend": "atlas",
  "audit_database": "portfolio_experiment_6e7f3aa82d754d5ea3312bf622a737fd",
  "reference_date": "2026-10-11",
  "amount_unit": "integer_cents",
  "status": "complete",
  "clips": [
    {
      "case_id": "500_no_50",
      "audio_file": "amount-correction.wav",
      "source": "synthetic_fixture",
      "verbatim": "Pay Demo Paper Supply 500, no, 50 dollars to demo-account-001 on 2026-10-11.",
      "cleaned": "Pay Demo Paper Supply 500 dollars to demo-account-001 on 2026-10-11.",
      "verbatim_terms": {
        "vendor_id": "vendor-001",
        "amount_cents": 5000,
        "destination_account": "demo-account-001",
        "date": "2026-10-11"
      },
      "cleaned_terms": {
        "vendor_id": "vendor-001",
        "amount_cents": 50000,
        "destination_account": "demo-account-001",
        "date": "2026-10-11"
      },
      "true_terms": {
        "vendor_id": "vendor-001",
        "amount_cents": 5000,
        "destination_account": "demo-account-001",
        "date": "2026-10-11"
      },
      "money_terms_diverged": true
    },
    {
      "case_id": "500_is_right",
      "audio_file": "amount-reaffirmation.wav",
      "source": "synthetic_fixture",
      "verbatim": "Pay Demo Paper Supply 500, no wait, 500 is right, dollars to demo-account-001 on 2026-10-11.",
      "cleaned": "Pay Demo Paper Supply 500 dollars to demo-account-001 on 2026-10-11.",
      "verbatim_terms": {
        "vendor_id": "vendor-001",
        "amount_cents": 50000,
        "destination_account": "demo-account-001",
        "date": "2026-10-11"
      },
      "cleaned_terms": {
        "vendor_id": "vendor-001",
        "amount_cents": 50000,
        "destination_account": "demo-account-001",
        "date": "2026-10-11"
      },
      "true_terms": {
        "vendor_id": "vendor-001",
        "amount_cents": 50000,
        "destination_account": "demo-account-001",
        "date": "2026-10-11"
      },
      "money_terms_diverged": false
    },
    {
      "case_id": "fifteen_vs_fifty",
      "audio_file": "fifteen-vs-fifty.wav",
      "source": "synthetic_fixture",
      "verbatim": "Pay Demo Paper Supply fifteen dollars, not fifty, to demo-account-001 on 2026-10-11.",
      "cleaned": "Pay Demo Paper Supply fifty dollars to demo-account-001 on 2026-10-11.",
      "verbatim_terms": {
        "vendor_id": "vendor-001",
        "amount_cents": 1500,
        "destination_account": "demo-account-001",
        "date": "2026-10-11"
      },
      "cleaned_terms": {
        "vendor_id": "vendor-001",
        "amount_cents": 5000,
        "destination_account": "demo-account-001",
        "date": "2026-10-11"
      },
      "true_terms": {
        "vendor_id": "vendor-001",
        "amount_cents": 1500,
        "destination_account": "demo-account-001",
        "date": "2026-10-11"
      },
      "money_terms_diverged": true
    },
    {
      "case_id": "account_42_sorry_24",
      "audio_file": "account-correction.wav",
      "source": "synthetic_fixture",
      "verbatim": "Pay Demo Catering 50 dollars to account ending 42, sorry, 24 on 2026-10-11.",
      "cleaned": "Pay Demo Catering 50 dollars to account ending 42 on 2026-10-11.",
      "verbatim_terms": {
        "vendor_id": "vendor-002",
        "amount_cents": 5000,
        "destination_account": "24",
        "date": "2026-10-11"
      },
      "cleaned_terms": {
        "vendor_id": "vendor-002",
        "amount_cents": 5000,
        "destination_account": "42",
        "date": "2026-10-11"
      },
      "true_terms": {
        "vendor_id": "vendor-002",
        "amount_cents": 5000,
        "destination_account": "24",
        "date": "2026-10-11"
      },
      "money_terms_diverged": true
    },
    {
      "case_id": "filler_only",
      "audio_file": "filler-only.wav",
      "source": "synthetic_fixture",
      "verbatim": "Um, uh, well, hmm.",
      "cleaned": "",
      "verbatim_terms": null,
      "cleaned_terms": null,
      "true_terms": null,
      "money_terms_diverged": false
    },
    {
      "case_id": "clean",
      "audio_file": "demo-invoice.wav",
      "source": "synthetic_fixture",
      "verbatim": "Um, pay Demo Paper Supply one hundred twenty-five dollars and fifty cents to demo-account-001 on October eleventh, 2026.",
      "cleaned": "Pay Demo Paper Supply $125.50 to demo-account-001 on 2026-10-11.",
      "verbatim_terms": {
        "vendor_id": "vendor-001",
        "amount_cents": 12550,
        "destination_account": "demo-account-001",
        "date": "2026-10-11"
      },
      "cleaned_terms": {
        "vendor_id": "vendor-001",
        "amount_cents": 12550,
        "destination_account": "demo-account-001",
        "date": "2026-10-11"
      },
      "true_terms": {
        "vendor_id": "vendor-001",
        "amount_cents": 12550,
        "destination_account": "demo-account-001",
        "date": "2026-10-11"
      },
      "money_terms_diverged": false
    }
  ],
  "case_manifest": [
    {
      "case_id": "500_no_50",
      "audio_file": "amount-correction.wav",
      "eval_set": "must_catch",
      "expected": "clarify",
      "source": "synthetic_fixture",
      "true_terms": {
        "vendor_id": "vendor-001",
        "amount_cents": 5000,
        "destination_account": "demo-account-001",
        "date": "2026-10-11"
      }
    },
    {
      "case_id": "500_is_right",
      "audio_file": "amount-reaffirmation.wav",
      "eval_set": "must_pass",
      "expected": "pay",
      "source": "synthetic_fixture",
      "true_terms": {
        "vendor_id": "vendor-001",
        "amount_cents": 50000,
        "destination_account": "demo-account-001",
        "date": "2026-10-11"
      }
    },
    {
      "case_id": "fifteen_vs_fifty",
      "audio_file": "fifteen-vs-fifty.wav",
      "eval_set": "must_catch",
      "expected": "clarify",
      "source": "synthetic_fixture",
      "true_terms": {
        "vendor_id": "vendor-001",
        "amount_cents": 1500,
        "destination_account": "demo-account-001",
        "date": "2026-10-11"
      }
    },
    {
      "case_id": "account_42_sorry_24",
      "audio_file": "account-correction.wav",
      "eval_set": "must_catch",
      "expected": "clarify",
      "source": "synthetic_fixture",
      "true_terms": {
        "vendor_id": "vendor-002",
        "amount_cents": 5000,
        "destination_account": "24",
        "date": "2026-10-11"
      }
    },
    {
      "case_id": "filler_only",
      "audio_file": "filler-only.wav",
      "eval_set": "must_pass",
      "expected": "pay",
      "source": "synthetic_fixture",
      "true_terms": null
    },
    {
      "case_id": "clean",
      "audio_file": "demo-invoice.wav",
      "eval_set": "must_pass",
      "expected": "pay",
      "source": "synthetic_fixture",
      "true_terms": {
        "vendor_id": "vendor-001",
        "amount_cents": 12550,
        "destination_account": "demo-account-001",
        "date": "2026-10-11"
      }
    },
    {
      "case_id": "queued_destination_change",
      "audio_file": "demo-invoice.wav",
      "eval_set": "must_catch",
      "expected": "reapprove",
      "source": "synthetic_fixture",
      "true_terms": {
        "vendor_id": "vendor-001",
        "amount_cents": 12550,
        "destination_account": "demo-account-001",
        "date": "2026-10-11"
      }
    },
    {
      "case_id": "benign_vendor_name",
      "audio_file": "demo-invoice.wav",
      "eval_set": "must_pass",
      "expected": "pay",
      "source": "synthetic_fixture",
      "true_terms": {
        "vendor_id": "vendor-001",
        "amount_cents": 12550,
        "destination_account": "demo-account-001",
        "date": "2026-10-11"
      }
    },
    {
      "case_id": "benign_vendor_memo",
      "audio_file": "demo-invoice.wav",
      "eval_set": "must_pass",
      "expected": "pay",
      "source": "synthetic_fixture",
      "true_terms": {
        "vendor_id": "vendor-001",
        "amount_cents": 12550,
        "destination_account": "demo-account-001",
        "date": "2026-10-11"
      }
    },
    {
      "case_id": "holdout_different_vendor",
      "audio_file": "holdout-vendor.wav",
      "eval_set": "holdout",
      "expected": "pay",
      "source": "synthetic_fixture",
      "true_terms": {
        "vendor_id": "vendor-003",
        "amount_cents": 8765,
        "destination_account": "demo-account-003",
        "date": "2026-10-11"
      }
    },
    {
      "case_id": "holdout_different_amounts",
      "audio_file": "holdout-amount.wav",
      "eval_set": "holdout",
      "expected": "clarify",
      "source": "synthetic_fixture",
      "true_terms": {
        "vendor_id": "vendor-002",
        "amount_cents": 8000,
        "destination_account": "24",
        "date": "2026-10-11"
      }
    },
    {
      "case_id": "holdout_account_13_sorry_31",
      "audio_file": "holdout-account.wav",
      "eval_set": "holdout",
      "expected": "clarify",
      "source": "synthetic_fixture",
      "true_terms": {
        "vendor_id": "vendor-003",
        "amount_cents": 7310,
        "destination_account": "31",
        "date": "2026-10-11"
      }
    },
    {
      "case_id": "holdout_second_destination_change",
      "audio_file": "holdout-destination.wav",
      "eval_set": "holdout",
      "expected": "reapprove",
      "source": "synthetic_fixture",
      "true_terms": {
        "vendor_id": "vendor-003",
        "amount_cents": 23456,
        "destination_account": "demo-account-003",
        "date": "2026-10-11"
      }
    },
    {
      "case_id": "holdout_benign_memo",
      "audio_file": "holdout-memo.wav",
      "eval_set": "holdout",
      "expected": "pay",
      "source": "synthetic_fixture",
      "true_terms": {
        "vendor_id": "vendor-003",
        "amount_cents": 8765,